<!ELEMENT menu (meals, beverages)>
<!ELEMENT meals (menuItem*)>
<!ELEMENT beverages (hotBeverages, otherBeverages)>
<!ELEMENT hotBeverages (menuItem*)>
<!ELEMENT otherBeverages (menuItem*)>
<!ELEMENT menuItem (name?, size?, price, description?, imageURL?)>
<!ELEMENT name (#PCDATA)>
<!ELEMENT size (#PCDATA)>
<!ELEMENT price (#PCDATA)>
<!ELEMENT description (#PCDATA)>
<!ELEMENT imageURL (#PCDATA)>